text,patent_id,ticker,numpat_total,issue_date,sector,clean_corpus
"FIELD OF THE INVENTION

This invention relates to a process for the boundary layer carbonation of solid particulate Trona ore to produce sodium bicarbonate. Impure Trona ore is generally comprised of mixtures of sodium sesquicarbonate (Na2CO3.NaHCO3.2H2O) with other materials, e.g., alkali minerals such as sodium chloride and sodium sulfate, as well as shales and clays. The invention also relates to such a process for the production of sodium bicarbonate useful in the desulfurization of flue gas.

BACKGROUND OF THE INVENTION

The conventional technique utilized in the commercial production of sodium bicarbonate is the solution process. In the solution process, soda ash is dissolved in spent reaction liquor from prior reaction, consisting of water and small quantities of dissolved soda ash and sodium bicarbonate. The solution is then carbonated by sparging CO2to the bottom of large carbonate columns to precipitate crystals of sodium bicarbonate. Carbonation of sodium bicarbonate is an example of a gas-liquid-solid reaction. The sodium bicarbonate crystals are typically separated from the liquor using centrifuges and dried to yield highly purified, high density crystals. Disadvantages of the conventional method are that the procedure requires several steps, and necessitates the use of separation equipment, drying of the product, and the handling of large volumes of liquids.

It has also been proposed to make sodium bicarbonate by various “dry carbonation” techniques. In U.S. Pat. No. 276,990 (Carey et al.) and U.S. Pat. No. 574,089 (Hawliczek), a sodium bicarbonate product is formed by placing hydrated soda ash in a revolving cylinder and then introducing carbon dioxide into the cylinder. In both patents, reaction times are of the order of five to six hours.

U.S. Pat. No. 3,647,365 (Saeman) teaches a process in which hollow sodium bicarbonate beads of low density are prepared in a multistage reactor from hydrated soda ash, small amounts of water and carbon dioxide. This process requires several steps and must proceed slowly, with carbonation times exceeding one hour and drying times up to eight hours. The soda ash must first be hydrated in a separate step, and the reaction must occur at a temperature above 95.7° F. to produce commercially acceptable reaction rates.

More recently, Krieg et al. (U.S. Pat. No. 4,459,272), (owned by the assignee of the present invention) described a process for the preparation of sodium bicarbonate by the reaction of a solid, particulate sodium carbonate-containing material with liquid water in a carbon dioxide-rich atmosphere. In the Krieg process, the particulate mass is mixed with the water and carbon dioxide in an internally agitated or externally rotated or vibrated reactor. The reaction is carried out at temperatures of from 125° F. to 240° F. under atmospheres containing from 20% to 90% carbon dioxide by volume. Using Krieg's terminology, the “dry carbonation” process is carried out under reduced water vapor partial pressures to promote evaporation of water from the surfaces of the reacting carbonate particles, and to maintain high carbon dioxide partial pressures in the reactor atmosphere. Products formed by the process have apparent bulk densities as high as 50-60 lb/ft3.

On the other hand, Sarapata, et al. in U.S. Pat. No. 4,664,893 (also owned by the assignee of the present invention) disclose that in the dry carbonation of sodium carbonate, it is necessary to react a substantially saturated feed gas stream (relative humidity in excess of 90%) to maintain adequate reaction rates.

Kurtz, et al. in U.S. Pat. No. 4,919,910 (also owned by the assignee of the present invention) disclose a process for the dry carbonation of potassium carbonate, which comprises reacting dry potassium carbonate, carbon dioxide and water vapor at atmospheric pressure and under turbulent mixing conditions to produce potassium bicarbonate.

WO 93/11070, published Jun. 10, 1993 and issued to Falotico and owned by the assignee of the present invention, a process is provided for the dry carbonation of Trona, which comprises:(a) passing Trona particles through a reaction zone (e.g., an internally agitated or externally rotated or vibrated reactor);(b) introducing into the reaction zone a gas stream containing from about 12% to 100% carbon dioxide by volume, any remaining percentage of the gas stream being an inert gas such as air or nitrogen, the gas stream being heated to a temperature within the range of about 140° F. to about 160° F. [about 60° to about 71.1° C.], preferably about 150° F. to about 155° F. [about 65.6° to about 68.3° C.];(c) initiating the reaction by introducing water into the reaction zone to form a gas mixture of water vapor and the gas stream from step (b), so that the water vapor content of the gas mixture reaches essentially 100% of saturation at the temperature of the gas stream from step (b);(d) thereafter during the course of the reaction, intermittently introducing water into the reaction zone to form “a gas mixture of water vapor and the gas stream from step (b), so that the water vapor content of the gas mixture reaches essentially 100% of saturation at the temperature of the gas stream from step (b), if required to maintain the reaction with a gas stream containing less than 100% CO2;(e) maintaining the gas mixture or gas stream in direct contact with the Trona particles during the reaction and continuing the reaction with production of water from the Trona and no external source of water when the gas stream is close to 100% CO2, until the sodium carbonate in the Trona particles is essentially all converted to sodium bicarbonate with a water content of less than about 4 percent by weight;(g) discharging the gas stream or gas mixture from the reaction zone after contact with the particles, and(h) discharging from the reaction zone reacted particles having a lower bulk density, a higher specific surface area and consequently higher absorption property than the Trona feed, and a water content of less than 4 percent by weight and different amounts of impurities (up to 20%) depending on their presence in the starting Trona ore, wherein sodium bicarbonate product formed by the dry carbonation has a surface area of about 0.3 m2/g. In contrast “wet” produced sodium bicarbonate has a surface area from about 0.05 to 0.09 m2/g.

Unfortunately, the process as proposed in WO 93/11070 requires at least 3 hours to convert the Trona to at least 98% sodium bicarbonate during a continuous reaction.

Prior art “dry carbonation” techniques are subject to particular disadvantages. In some of these processes, the carbon dioxide concentration must be high and the reaction temperature must also be high, or the reaction rate is prohibitively low. In some, the product must be dried. Despite a passing reference to the use of calcined Trona in U.S. Pat. No. 4,459,272, none of the patents disclose the surprising benefits and properties that result from the boundary layer carbonation process of the present invention.

Sodium bicarbonate has also been produced, as well as utilized, in dry sorbent injection processes for removing sulfur dioxide emissions from the combustion gases of fossil fuel-fired burners. Such techniques have commanded considerable attention recently, particularly because they present the lowest “first cost” alternative for removing potentially dangerous sulfur dioxide and other gases from flue gases. Sodium bicarbonate has been demonstrated to be a very effective sorbent in the dry sorbent injection process. However, the cost of pharmaceutical and food grade sodium bicarbonate, as currently produced, is a major drawback to its use for such purpose.

U.S. Pat. No. 3,846,535 (Fonseca) and U.S. Pat. No. 4,385,039 (Lowell et al.) disclose methods for regenerating sodium bicarbonate from sulfate-containing solid waste formed by dry sorbent injection with sodium bicarbonate. The Fonseca regeneration step is carried out by forming an aqueous solution of the sodium sulfate-containing waste, and treating such solution with ammonium bicarbonate to precipitate sodium bicarbonate. The sodium bicarbonate is then separated, dried and recycled for further use. Lowell et al. disclose a regeneration step which involves dissolving the solid desulfurization reaction product in an alkaline liquor, which contains borate ions and/or ammonia. Carbonation of this liquor results in a sodium bicarbonate precipitate. The Fonseca and Lowell et al. processes thus both suffer from the use of complicated and capital intensive solution operations.

Sarapata, et al. in U.S. Pat. No. 4,664,893, mentioned above, also disclose that their “dry carbonation” process may be used to desulfurize flue gas streams, wherein the flue gas is contacted with a solid alkali metal or ammonium bicarbonate containing sorbent to react with sulfur dioxide in the flue gas. The resulting solid waste is separated and removed from the gas stream. The cleansed gas stream, from which the solid waste has been removed, is cooled; the gas stream is saturated with water vapor; and the gas stream is thoroughly mixed with a particulate alkali metal or ammonium carbonate. The bicarbonate produced thereby is then utilized to contact the hot flue gas for further desulfurization thereof.

SUMMARY OF THE INVENTION

This patent discloses a boundary layer carbonation process for the production of sodium bicarbonate from Trona. In one embodiment the process comprises the steps of: providing Trona particles; pre-wetting the Trona particles with water to provide a plurality of pre-wetted Trona particles; and boundary layer carbonating the pre-wetted Trona particles to convert the pre-wetted Trona particles into crystals of sodium bicarbonate having a surface area between 0.7 m2/g and 1.6 m2/g.

",8795615,CHD,395,8/5/2014,Consumer Staples,"field invent invent relat process boundari layer carbon solid particul trona ore produc sodium bicarbon impur trona ore general compris mixtur sodium sesquicarbon na2co3.nahco3.2h2o materi e.g. alkali miner sodium chlorid sodium sulfat well shale clay invent also relat process product sodium bicarbon use desulfur flue gas background invent convent techniqu util commerci product sodium bicarbon solut process solut process soda ash dissolv spent reaction liquor prior reaction consist water small quantiti dissolv soda ash sodium bicarbon solut carbon sparg co2to bottom larg carbon column precipit crystal sodium bicarbon carbon sodium bicarbon exampl gas-liquid-solid reaction sodium bicarbon crystal typic separ liquor use centrifug dri yield high purifi high densiti crystal disadvantag convent method procedur requir sever step necessit use separ equip dri product handl larg volum liquid also propos make sodium bicarbon various dri carbon techniqu u.s. pat 276,990 carey et al u.s. pat 574,089 hawliczek sodium bicarbon product form place hydrat soda ash revolv cylind introduc carbon dioxid cylind patent reaction time order five six hour u.s. pat 3,647,365 saeman teach process hollow sodium bicarbon bead low densiti prepar multistag reactor hydrat soda ash small amount water carbon dioxid process requir sever step must proceed slowli carbon time exceed one hour dri time eight hour soda ash must first hydrat separ step reaction must occur temperatur abov f. produc commerci accept reaction rate recent krieg et al u.s. pat 4,459,272 assigne present invent describ process prepar sodium bicarbon reaction solid particul sodium carbonate-contain materi liquid water carbon dioxide-rich atmospher krieg process particul mass mix water carbon dioxid intern agit extern rotat vibrat reactor reaction carri temperatur f. f. atmospher contain 20 90 carbon dioxid volum use krieg 's terminolog dri carbon process carri reduc water vapor partial pressur promot evapor water surfac react carbon particl maintain high carbon dioxid partial pressur reactor atmospher product form process appar bulk densiti high 50-60 lb/ft3 hand sarapata et al u.s. pat 4,664,893 also assigne present invent disclos dri carbon sodium carbon necessari react substanti satur feed gas stream relat humid excess 90 maintain adequ reaction rate kurtz et al u.s. pat 4,919,910 also assigne present invent disclos process dri carbon potassium carbon compris react dri potassium carbon carbon dioxid water vapor atmospher pressur turbul mix condit produc potassium bicarbon wo 93/11070 publish jun 10 1993 issu falotico assigne present invent process provid dri carbon trona compris pass trona particl reaction zone e.g. intern agit extern rotat vibrat reactor b introduc reaction zone gas stream contain 12 100 carbon dioxid volum ani remain percentag gas stream inert gas air nitrogen gas stream heat temperatur within rang f. f. c. prefer f. f. c. c initi reaction introduc water reaction zone form gas mixtur water vapor gas stream step b water vapor content gas mixtur reach essenti 100 satur temperatur gas stream step b thereaft dure cours reaction intermitt introduc water reaction zone form gas mixtur water vapor gas stream step b water vapor content gas mixtur reach essenti 100 satur temperatur gas stream step b requir maintain reaction gas stream contain less 100 co2 e maintain gas mixtur gas stream direct contact trona particl dure reaction continu reaction product water trona extern sourc water gas stream close 100 co2 sodium carbon trona particl essenti convert sodium bicarbon water content less 4 percent weight g discharg gas stream gas mixtur reaction zone contact particl h discharg reaction zone react particl lower bulk densiti higher specif surfac area consequ higher absorpt properti trona feed water content less 4 percent weight differ amount impur 20 depend presenc start trona ore wherein sodium bicarbon product form dri carbon surfac area 0.3 m2/g contrast wet produc sodium bicarbon surfac area 0.05 0.09 m2/g unfortun process propos wo 93/11070 requir least 3 hour convert trona least 98 sodium bicarbon dure continu reaction prior art dri carbon techniqu subject particular disadvantag process carbon dioxid concentr must high reaction temperatur must also high reaction rate prohibit low product must dri despit pass refer use calcin trona u.s. pat 4,459,272 none patent disclos surpris benefit properti result boundari layer carbon process present invent sodium bicarbon also produc well util dri sorbent inject process remov sulfur dioxid emiss combust gase fossil fuel-fir burner techniqu command consider attent recent particular becaus present lowest first cost altern remov potenti danger sulfur dioxid gase flue gase sodium bicarbon demonstr veri effect sorbent dri sorbent inject process howev cost pharmaceut food grade sodium bicarbon current produc major drawback use purpos u.s. pat 3,846,535 fonseca u.s. pat 4,385,039 lowel et al disclos method regener sodium bicarbon sulfate-contain solid wast form dri sorbent inject sodium bicarbon fonseca regener step carri form aqueous solut sodium sulfate-contain wast treat solut ammonium bicarbon precipit sodium bicarbon sodium bicarbon separ dri recycl use lowel et al disclos regener step involv dissolv solid desulfur reaction product alkalin liquor contain borat ion and/or ammonia carbon liquor result sodium bicarbon precipit fonseca lowel et al process thus suffer use complic capit intens solut oper sarapata et al u.s. pat 4,664,893 mention abov also disclos dri carbon process may use desulfur flue gas stream wherein flue gas contact solid alkali metal ammonium bicarbon contain sorbent react sulfur dioxid flue gas result solid wast separ remov gas stream cleans gas stream solid wast remov cool gas stream satur water vapor gas stream thorough mix particul alkali metal ammonium carbon bicarbon produc therebi util contact hot flue gas desulfur thereof summari invent patent disclos boundari layer carbon process product sodium bicarbon trona one embodi process compris step provid trona particl pre-wet trona particl water provid plural pre-wet trona particl boundari layer carbon pre-wet trona particl convert pre-wet trona particl crystal sodium bicarbon surfac area 0.7 m2/g 1.6 m2/g"
