text,patent_id,ticker,numpat_total,issue_date,sector,clean_corpus
"FIELD OF THE INVENTION

The present invention relates to an absorbent composition for animal dross and its method of use. More particularly, the present invention relates to a litter that displays colored speckles without being color transferable.

BACKGROUND OF THE INVENTION

Before the advent of litters, pet owner had relegated pets to outside the home for lack of an area for taking care of pet excrement. Litters allow pets to take care of waste functions and live inside the home. House-broken animals, such as cats, are trained into the habit of urinating and defecating in a specially provided litter box. Similarly, untrained and caged animals, such as guinea pigs, urinate and defecate on the floor of their cage, often in approximately the same floor area of the cage. Consequently, pet owners, homeowners, veterinarians and laboratory personnel have added absorbent materials to the litter box or cage to collect the urine and feces.

The dross-soiled absorbent must be regularly cleaned to maintain a hygienic environment and to thwart the emission of objectionable odors from the presence of the urine and fecal matter in the litter. Removal of fecal matter from any litter is somewhat easy as they are generally solid objects that can be physically removed from the litter. However, physical removal of the feces does not address the issues of removing liquid dross from the litter nor does it help reduce or eliminate odors caused by the urine absorbed into the absorbent. Thus it can be said that the removal of the liquid dross from the litter is harder to execute.

Though the absorbent material aids in absorbing liquid dross, removal of the liquid dross and identification of the liquid dross in the litter is still difficult. Therefore, when the odors caused by the absorbed urine become intolerable, the homeowner discards the litter box absorbent material entirely. Consequently, the litter box absorbent material usually is a relatively inexpensive solid absorbent material, such that an individual cleaning of the litter box is not particularly economically burdensome.

The most commonly used litter box absorbent materials are inexpensive clays, such as calcined clays, that are safe and non-irritating to the animals, and that absorb relatively substantial amounts of liquids. Other porous, solid litter box absorbent materials, that are used alone or in combination, include straw, sawdust, wood chips, wood shavings, porous polymeric beads, shredded paper, sand, bark, cloth, ground corn husks, cellulose, and water-insoluble inorganic salts, such as calcium sulfate. Each of these absorbent materials has the advantage of low cost. For each absorbent material, offensive odors are eventually caused by the absorbed urine, and the entire contents of the litter box, including soiled absorbent material and unsoiled absorbent material, will eventually have to be replaced.

Currently clumping clays and other water absorbent material are used to improve litter compositions. An improved composition for animal litters uses the clayey soils or comminuted rocks, e.g. the sodium bentonites, comprising at least one water-swellable clay mineral in the montmorillonite clay family. These water absorbent materials not only absorb liquid dross, but they aid in the identification of used litter from unused litter portions. These water absorbent materials have the ability to clump and harden after contact with an aqueous liquid such as urine thus facilitating the removal of only the soiled portion of the litter in a litter box or cage during cleaning without the necessity of removing all the litter. The wetted clump has the ability to group into a size substantially larger than the individual particles comprising the litter.

Though these improved compositions have eased the owners' task of removing soiled litter portions, they are still short of addressing problems associated with the burial or splitting of the clumped dross. The buried or split clump, if not timely discovered, will emit offensive odors within a relatively short period of time. Thus when the clumped dross is buried or split the homeowner must still either patiently sift through the litter to remove the used portions or simply discard the partially soiled litter. As a result the benefits of having a clumped litter diminishes since the removal of the clumped dross once again becomes a time-consuming as well as costly process.

The following prior art references illustrate aspects of the technology of animal litter preparation, and, in particular, disclose the use of clays in such litters.

U.S. Pat. No. 4,685,420 issued Aug. 11, 1987 to Stuart, discloses an animal litter composition comprising a water-absorbing polymer such as a polyacrylate combined with a porous inert solid substrate such as clay.

U.S. Pat. No. 5,000,115 issued Mar. 19, 1991 to Hughes, discloses the use of a water swellable bentonite clay as an absorbent litter material. The clay absorbs the liquids in animal waste which on contacting the clay agglomerates it into a stable mass easily separated from the unwetted and unsoiled portion of the composition.

U.S. Pat. No. 5,267,532 issued Dec. 7, 1993 to Franklin, et al., discloses a pH-indicating material maintained on an inert carrier that is separate from the cat litter material. The pH-indicating material has dual indicators that provide one color transition at a low pH and a different color transition at a high pH so that acidic or alkaline animal urine problems can be visibly detected upon contact between the animal urine and the pH-indicating material. The pH-indicating material is water and urine soluble and easily transferable.

U.S. Pat. No. 5,371,054 issued Dec. 6, 1994 to Pluta, et al., discloses an animal litter composition used to diagnose animal health problems. The composition comprises at least one uncalcined clay substrate having a calcium oxide content of less than about 5% by weight and wherein the clay mineral component of said substrate has a attapulgite content of at least about 35% by weight, in combination with at least one chemical pH indicator. All pH indicators are water soluble and easily transferable.

U.S. Pat. No. 6,619,233 issued Sep. 16, 2003 and U.S. Pat. No. 6,763,783 issued Jul. 20, 2004 both to Mochizuki, disclose a granulated-type, urine-discharge processing material for animals that discriminates between before-use and after-use. The material comprises a water absorbent granular body dyed with water soluble dyes or a water absorbent granular body containing powder of water soluble dyes (which will make it color transferable), and a water absorbent surface layer covering a surface of the water absorbent granular body. The water absorbent surface layer and the water absorbent granular body are bonded to each other through a non-continuous water soluble adhesive layer formed of a plurality of adhesive non-coated parts and a plurality of adhesive coated parts which is coated on the surface of the water absorbent granular body. Discharged animal urine is permeated into the water absorbent granular body through the water absorbent surface layer and the non-continuous water soluble adhesive layer, or by dissolving the adhesive coated parts. Thereby, the water soluble dyes are eluted into the discharged urine so that the water absorbent surface layer is dyed through the non-continuous water soluble adhesive layer. The water absorbent granular body is chiefly composed of vegetable fiber or vegetable powder and contains inorganic fillers. The water absorbent granular body further contains powder of a water absorbent polymer so that the granular body can have rich water absorbing and retaining properties. No mention is made to clays in the patent.

Color-indicating litters are the most recent advance in litters, however, use of these litters are still problematic. Despite the common problem of tracking the litter in the home, these color-indicating litters may not only be tracked inside the home, but can discolor home furnishings such as carpets, couches and the like, making a small problem even worse. A need exists for a litter that imparts a color but will not bleed into home furnishings even if tracked by the pet through the home.

SUMMARY OF THE INVENTION

A non-color transferable animal litter is disclosed that contains painted particulate material and non-painted water absorbent material. The absorbent material may be any clumping or non-clumping material known in the art. Once painted, the particles are colorfast and do not interfere with the function of the non-painted water absorbent materials. The painted particles are colorfast, non-water soluble and impart a speckled appearance to the litter.

",7665418,CHD,395,2/23/2010,Consumer Staples,"field invent present invent relat absorb composit anim dross method use particular present invent relat litter display color speckl without color transfer background invent befor advent litter pet owner releg pet outsid home lack area take care pet excrement litter allow pet take care wast function live insid home house-broken anim cat train habit urin defec special provid litter box similar untrain cage anim guinea pig urin defec floor cage often approxim floor area cage consequ pet owner homeown veterinarian laboratori personnel ad absorb materi litter box cage collect urin fece dross-soil absorb must regular clean maintain hygien environ thwart emiss objection odor presenc urin fecal matter litter remov fecal matter ani litter somewhat easi general solid object physic remov litter howev physic remov fece doe address issu remov liquid dross litter doe help reduc elimin odor caus urin absorb absorb thus said remov liquid dross litter harder execut though absorb materi aid absorb liquid dross remov liquid dross identif liquid dross litter still difficult therefor odor caus absorb urin becom intoler homeown discard litter box absorb materi entir consequ litter box absorb materi usual relat inexpens solid absorb materi individu clean litter box particular econom burdensom common use litter box absorb materi inexpens clay calcin clay safe non-irrit anim absorb relat substanti amount liquid porous solid litter box absorb materi use alon combin includ straw sawdust wood chip wood shave porous polymer bead shred paper sand bark cloth ground corn husk cellulos water-insolubl inorgan salt calcium sulfat absorb materi advantag low cost absorb materi offens odor eventu caus absorb urin entir content litter box includ soil absorb materi unsoil absorb materi eventu replac current clump clay water absorb materi use improv litter composit improv composit anim litter use clayey soil comminut rock e.g sodium bentonit compris least one water-swel clay miner montmorillonit clay famili water absorb materi onli absorb liquid dross aid identif use litter unus litter portion water absorb materi abil clump harden contact aqueous liquid urin thus facilit remov onli soil portion litter litter box cage dure clean without necess remov litter wet clump abil group size substanti larger individu particl compris litter though improv composit eas owner task remov soil litter portion still short address problem associ burial split clump dross buri split clump time discov emit offens odor within relat short period time thus clump dross buri split homeown must still either patient sift litter remov use portion simpli discard partial soil litter result benefit clump litter diminish sinc remov clump dross onc becom time-consum well cost process follow prior art refer illustr aspect technolog anim litter prepar particular disclos use clay litter u.s. pat 4,685,420 issu aug. 11 1987 stuart disclos anim litter composit compris water-absorb polym polyacryl combin porous inert solid substrat clay u.s. pat 5,000,115 issu mar 19 1991 hugh disclos use water swellabl bentonit clay absorb litter materi clay absorb liquid anim wast contact clay agglomer stabl mass easili separ unwet unsoil portion composit u.s. pat 5,267,532 issu dec. 7 1993 franklin et al. disclos ph-indic materi maintain inert carrier separ cat litter materi ph-indic materi dual indic provid one color transit low ph differ color transit high ph acid alkalin anim urin problem visibl detect upon contact anim urin ph-indic materi ph-indic materi water urin solubl easili transfer u.s. pat 5,371,054 issu dec. 6 1994 pluta et al. disclos anim litter composit use diagnos anim health problem composit compris least one uncalcin clay substrat calcium oxid content less 5 weight wherein clay miner compon said substrat attapulgit content least 35 weight combin least one chemic ph indic ph indic water solubl easili transfer u.s. pat 6,619,233 issu sep. 16 2003 u.s. pat 6,763,783 issu jul 20 2004 mochizuki disclos granulated-typ urine-discharg process materi anim discrimin before-us after-us materi compris water absorb granular bodi dy water solubl dye water absorb granular bodi contain powder water solubl dye make color transfer water absorb surfac layer cover surfac water absorb granular bodi water absorb surfac layer water absorb granular bodi bond non-continu water solubl adhes layer form plural adhes non-coat part plural adhes coat part coat surfac water absorb granular bodi discharg anim urin permeat water absorb granular bodi water absorb surfac layer non-continu water solubl adhes layer dissolv adhes coat part therebi water solubl dye elut discharg urin water absorb surfac layer dy non-continu water solubl adhes layer water absorb granular bodi chiefli compos veget fiber veget powder contain inorgan filler water absorb granular bodi contain powder water absorb polym granular bodi rich water absorb retain properti mention made clay patent color-ind litter recent advanc litter howev use litter still problemat despit common problem track litter home color-ind litter may onli track insid home discolor home furnish carpet couch like make small problem even wors need exist litter impart color bleed home furnish even track pet home summari invent non-color transfer anim litter disclos contain paint particul materi non-paint water absorb materi absorb materi may ani clump non-clump materi known art onc paint particl colorfast interfer function non-paint water absorb materi paint particl colorfast non-wat solubl impart speckl appear litter"
"FIELD OF THE INVENTION

The present invention relates to the field of toothbrushes, and more particularly, the invention relates to the field of electrically powered toothbrushes, and actuators and packaging therefor.

BACKGROUND OF THE INVENTION

Electric toothbrushes typically utilize a switch accessible along the exterior or body of the toothbrush that controls operation of the toothbrush. Generally, such switches have two positions, one position in which the toothbrush is not operating or “off” and another position in which the toothbrush is activated or “on.” Generally, these switches are slidable or otherwise linearly displaceable between these two positions. Such position switches have also been modified to also activate their corresponding circuits or mechanisms upon being pushed or depressed. This pushbutton feature may be provided in combination with the previously noted linear position function in a single switch.

Most consumer goods and particularly those that relate to health and beauty are packaged in retail-friendly display cartons such that the product that is being sold may be readily viewed by a consumer contemplating its purchase. Such packaging is currently used for many different brands and models of commercially available electric toothbrushes.

Multi-motion electric toothbrushes are known which are believed to provide superior cleaning efficacy. These toothbrushes often provide multiple brushing motions by two or more brush heads. In addition to the superior cleaning action, the operation of the brush and complex motion of the brush heads often generates interest in a potential purchaser of the toothbrush. That is, many consumers find the operation of the brush to be interesting to watch.

As a result of this phenomenon, the assignee of the present invention previously developed a package for an electric toothbrush that was adapted for retail display and enabled a consumer to activate the toothbrush while sealed within the package. Accordingly, an interested consumer could simply activate a packaged toothbrush by pushing the switch of the toothbrush through its packaging. Some such arrangements are shown in commonly assigned U.S. Pat. Nos. 6,311,837; 6,189,693; and 6,178,579, the substances of which are incorporated herein by reference.

A significant problem with such consumer friendly packaging is that the toothbrush may accidentally be activated during shipment or storage. Furthermore, it is neither practical nor economical to include actuation interlocks in the packaging or to somehow “arm” or selectively enable actuation of the toothbrush prior to retail display.

Accordingly, there is a significant need for an electric toothbrush that may utilize current retail packaging approaches and may be activated after packaging, yet which would not be prone to accidental or unintended activation particularly while in its package.

SUMMARY OF THE INVENTION

The present invention achieves all of the foregoing objectives and provides, in a first aspect, a packaged electric toothbrush comprising a package having a cover, a back, and a cavity defined therebetween. The package cover includes a projection that extends from an interior face of the cover. The packaged toothbrush also comprises an electric toothbrush disposed within the cavity of the package. The toothbrush includes a housing, a neck, and a head. The housing has a motor and a power source for energizing the motor. The motor is engaged with a movable bristle holder disposed on the head. The electric toothbrush also includes a first movable member which may be moved between two positions. The electric toothbrush is energized when the movable member is in the second position. The first movable member has a second movable member that is slideably disposed within the first member. The second movable member is movable in a direction that is substantially perpendicular to the direction of movement of the first movable member. The second movable member is positioned adjacent the projection extending from the interior face of the cover. The electric toothbrush may also be energized by applying a force upon the package cover near the projection to thereby cause the projection to contact and depress the second movable member when the first movable member is in its first position.

In yet another aspect, the present invention provides a packaged electric toothbrush comprising a package having a cover that defines a hollow interior within the package. The cover has an outwardly directed outer face and an oppositely directed inner face. The inner face has a projection extending from the inner face into the hollow interior of the package. The packaged electric toothbrush also comprises an electric toothbrush disposed within the hollow interior of the package. The toothbrush includes an actuator assembly positioned adjacent the projection of the cover. The actuator assembly has a first slidable component and a second depressible component residing within an aperture defined in the first slidable component. The electric toothbrush is momentarily activated by pressing the cover and causing the projection extending from the inner face to contact and depress the depressible component of the actuator assembly.

In a further aspect, the present invention provides a method for momentarily activating an electric toothbrush disposed within a package. The electric toothbrush has an actuator for preventing accidental or unintended activation. The actuator includes a first slidable component disposed on a housing of the toothbrush. This slidable component defines an aperture within which is disposed a depressible component configured such that upon depressing the depressible component within the aperture, the electric toothbrush is activated. This method includes a step of providing a projection extending from an inwardly directed face of the package. The projection is positioned alongside the depressible component and sized to fit within the aperture defined in the slidable component. The method also includes a step of pressing the package in the proximity of the actuator such that the projection contacts the depressible component and thereby activates the electric toothbrush.

",7723629,CHD,395,5/25/2010,Consumer Staples,"field invent present invent relat field toothbrush particular invent relat field electr power toothbrush actuat packag therefor background invent electr toothbrush typic util switch access along exterior bodi toothbrush control oper toothbrush general switch two posit one posit toothbrush oper anoth posit toothbrush activ on. general switch slidabl otherwis linear displac two posit posit switch also modifi also activ correspond circuit mechan upon push depress pushbutton featur may provid combin previous note linear posit function singl switch consum good particular relat health beauti packag retail-friend display carton product sold may readili view consum contempl purchas packag current use mani differ brand model commerci avail electr toothbrush multi-mot electr toothbrush known believ provid superior clean efficaci toothbrush often provid multipl brush motion two brush head addit superior clean action oper brush complex motion brush head often generat interest potenti purchas toothbrush mani consum find oper brush interest watch result phenomenon assigne present invent previous develop packag electr toothbrush adapt retail display enabl consum activ toothbrush seal within packag accord interest consum could simpli activ packag toothbrush push switch toothbrush packag arrang shown common assign u.s. pat nos 6,311,837 6,189,693 6,178,579 substanc incorpor herein refer signific problem consum friend packag toothbrush may accident activ dure shipment storag furthermor neither practic econom includ actuat interlock packag somehow arm select enabl actuat toothbrush prior retail display accord signific need electr toothbrush may util current retail packag approach may activ packag yet would prone accident unintend activ particular packag summari invent present invent achiev forego object provid first aspect packag electr toothbrush compris packag cover back caviti defin therebetween packag cover includ project extend interior face cover packag toothbrush also compris electr toothbrush dispos within caviti packag toothbrush includ hous neck head hous motor power sourc energ motor motor engag movabl bristl holder dispos head electr toothbrush also includ first movabl member may move two posit electr toothbrush energ movabl member second posit first movabl member second movabl member slideabl dispos within first member second movabl member movabl direct substanti perpendicular direct movement first movabl member second movabl member posit adjac project extend interior face cover electr toothbrush may also energ appli forc upon packag cover near project therebi caus project contact depress second movabl member first movabl member first posit yet anoth aspect present invent provid packag electr toothbrush compris packag cover defin hollow interior within packag cover outward direct outer face opposit direct inner face inner face project extend inner face hollow interior packag packag electr toothbrush also compris electr toothbrush dispos within hollow interior packag toothbrush includ actuat assembl posit adjac project cover actuat assembl first slidabl compon second depress compon resid within apertur defin first slidabl compon electr toothbrush momentarili activ press cover caus project extend inner face contact depress depress compon actuat assembl aspect present invent provid method momentarili activ electr toothbrush dispos within packag electr toothbrush actuat prevent accident unintend activ actuat includ first slidabl compon dispos hous toothbrush slidabl compon defin apertur within dispos depress compon configur upon depress depress compon within apertur electr toothbrush activ method includ step provid project extend inward direct face packag project posit alongsid depress compon size fit within apertur defin slidabl compon method also includ step press packag proxim actuat project contact depress compon therebi activ electr toothbrush"
