text,patent_id,ticker,numpat_total,issue_date,sector,clean_corpus
"FIELD OF THE INVENTION

The invention relates to depilatory compositions which can be peeled away from the skin.

BACKGROUND OF THE INVENTION

As an alternative to shaving, many hair removal products available today perform through either chemical degradation (depilation) or mechanical removal (epilation) of the hair. Compositions for removing superfluous body hair are well known and are of various types. Currently on the market there are many different types of chemical depilatories and epilation products. Epilatory products, such as waxing, require initial heating before being applied to the skin in a generally molten state. It is then allowed to solidify before being removed from the skin together with unwanted hair.

One major drawback with waxing is the pain associated with hair removal. Waxing works by pulling the hair out from the roots. The hair follicle is surrounded by a small muscle that allows the hair to be erected in response to cold or excitement. Also attached with this muscle are nerve endings.

These structures make pulling the hair out fairly hard and painful. The pain creates a fear associated with the waxing procedure which will cause many people not to repeat the procedure. Even if the person does repeat the waxing, the fear can cause the muscles to tense up, which in turn creates even more pain in subsequent procedures.

Chemical-based depilation offers an attractive alternative to waxing or shaving with the removal of hair being accomplished through the cleavage of disulfide bonds in the hair fiber as well as denaturation of the associated protein matrix. Unlike waxing, chemical-based depilation digests the hair and the hair is not pulled out, thus avoiding the pain associated with waxing. However, a relatively small proportion of individuals, compared with shaving, employ depilatories. One reason for the limited use may be that the hair cleavage reaction must be run at a very high pH. A typical example is the Nair® lotion product, having a pH of about 12.5 to 13.

Chemical-based depilatory compositions typically use a thiol-based depilatory agent, such as thioglycolic acid, for removal of unwanted body and facial hair and its use is well established in the art. These agents react by reducing hair's protein disulfide bonds to sulfhydryl anions, thereby allowing easy removal of the weakened hairs when washed or wiped away. However, in using thiols, it was discovered that certain conditions facilitated the effectiveness of this reaction. One such condition is high alkalinity to provide ionized reactants. Not only does the high pH (approximately 12.0-13) result in ionized thiols, but they also result in increased penetration of a reactant. Substances to provide further enhancement of penetration by active thiols were developed.

Currently on the market there are many different types of chemical depilatories. They range in form from creams to gel to aerosol mousses and spray products. Depilatory composition in the form of a cream is applied to the skin at room temperature. One drawback to many of these depilatory products is the required clean up. As discussed earlier, chemical depilatories contain a strong alkaline, usually a metal hydroxide. In addition, there is usually a reducing agent used. These chemicals can cause considerable damage to the skin if not properly removed. Likewise, they will quickly cause significant damage if they get into the eyes. Product wiped off the skin is still active and will corrode aluminum and many organic materials, creating the possibility of property damage or injury to the user, children or pets through inadvertent contact.

Products have been made to help reduce the risks associated with using these high pH depilatory products by trapping the dangerous chemicals in a solid matrix, i.e., a semi-solid film, after use, thereby simplifying disposal because there will not be liquid which can stick to surfaces. These depilatory products form a dry rubbery film on the skin which after a period of a few minutes can be peeled in one piece from the skin. In this manner, the product is similar to a hot wax depilation. After removal of the product, a very slight residue is left behind, which could be removed with a damp towel. However, unlike wax, the hair will have been digested by chemicals and not pulled out, thereby avoiding the pain associated with pulling out hair as in waxing. Further, there is the elimination of a great deal of mess. European Patent Application No. 0196896A2 to Hori et al. describes such a product.

European Patent Application No. 0196896A2 describes a depilatory composition comprising an aqueous solution or emulsion (e.g. a paste or gel) of a depilatory agent, a film-forming polymer (such as poly(vinyl alcohol)), which can be water-soluble or insoluble, and optionally an alkali hair swelling accelerating agent or a filler. The composition of European Patent Application No. 0196896A2 is spread on an area of skin having hair, the coating is allowed to dry naturally or by treating with hot air and/or absorbing water into an absorbent sheet pressed onto the film; and the film is peeled off with the hairs embedded therein, optionally with use of a pressure-sensitive adhesive sheet placed on the film.

In using these depilatory compositions, it is advantageous to have compositions which are capable of forming films when they are applied to the skin. Compositions having film-forming properties have the advantages of facilitating the removal of the depilatory composition from the skin and the ease of disposal of the depilatory composition along with the digested hairs simply by peeling off the dried composition.

The components imparting the above-noted film-forming properties are generally high-molecular-weight polymers. To obtain substantial film-forming properties in depilatory compositions, it is not satisfactory to simply increase the concentration of these high-molecular-weight polymers in the depilatory compositions. Such an approach is indeed limited by the fact that these film-forming polymers excessively increase the viscosity of the finished product. The finished product becomes too thick; it is thus difficult to apply to the skin and therefore preventing the user from being able to properly apply the depilatory composition.

It would be most useful to formulate a depilatory composition with substantial film-forming properties, but in such a way that the viscosity of depilatory composition is low enough to properly apply to the skin as a thin film prior to forming a film.

SUMMARY OF THE INVENTION

The present invention relates to a depilation composition and method for removing hair without causing pain. The depilation composition of the present invention comprises an aqueous solvent system containing a film-forming polymer compound and a depilatory agent wherein the depilation composition forms a peelable film after drying. The present invention also relates to a depilation method comprising coating the aforementioned depilatory composition onto an area of skin where hair is to be removed, drying the resulting coating to form a peelable film, and then peeling off the film. The depilation composition of the present invention uses a blend of fully and partially hydrolyzed poly(vinyl alcohol).

",9205037,CHD,395,12/8/2015,Consumer Staples,field invent invent relat depilatori composit peel away skin background invent altern shave mani hair remov product avail today perform either chemic degrad depil mechan remov epil hair composit remov superflu bodi hair well known various type current market mani differ type chemic depilatori epil product epilatori product wax requir initi heat befor appli skin general molten state allow solidifi befor remov skin togeth unwant hair one major drawback wax pain associ hair remov wax work pull hair root hair follicl surround small muscl allow hair erect respons cold excit also attach muscl nerv end structur make pull hair fair hard pain pain creat fear associ wax procedur caus mani peopl repeat procedur even person doe repeat wax fear caus muscl tens turn creat even pain subsequ procedur chemical-bas depil offer attract altern wax shave remov hair accomplish cleavag disulfid bond hair fiber well denatur associ protein matrix unlik wax chemical-bas depil digest hair hair pull thus avoid pain associ wax howev relat small proport individu compar shave employ depilatori one reason limit use may hair cleavag reaction must run veri high ph typic exampl lotion product ph 12.5 13. chemical-bas depilatori composit typic use thiol-bas depilatori agent thioglycol acid remov unwant bodi facial hair use well establish art agent react reduc hair 's protein disulfid bond sulfhydryl anion therebi allow easi remov weaken hair wash wipe away howev use thiol discov certain condit facilit effect reaction one condit high alkalin provid ioniz reactant onli doe high ph approxim 12.0-13 result ioniz thiol also result increas penetr reactant substanc provid enhanc penetr activ thiol develop current market mani differ type chemic depilatori rang form cream gel aerosol mouss spray product depilatori composit form cream appli skin room temperatur one drawback mani depilatori product requir clean discuss earlier chemic depilatori contain strong alkalin usual metal hydroxid addit usual reduc agent use chemic caus consider damag skin proper remov likewis quick caus signific damag get eye product wipe skin still activ corrod aluminum mani organ materi creat possibl properti damag injuri user children pet inadvert contact product made help reduc risk associ use high ph depilatori product trap danger chemic solid matrix i.e. semi-solid film use therebi simplifi dispos becaus liquid stick surfac depilatori product form dri rubberi film skin period minut peel one piec skin manner product similar hot wax depil remov product veri slight residu left behind could remov damp towel howev unlik wax hair digest chemic pull therebi avoid pain associ pull hair wax elimin great deal mess european patent applic 0196896a2 hori et al describ product european patent applic 0196896a2 describ depilatori composit compris aqueous solut emuls e.g past gel depilatori agent film-form polym poli vinyl alcohol water-solubl insolubl option alkali hair swell acceler agent filler composit european patent applic 0196896a2 spread area skin hair coat allow dri natur treat hot air and/or absorb water absorb sheet press onto film film peel hair embed therein option use pressure-sensit adhes sheet place film use depilatori composit advantag composit capabl form film appli skin composit film-form properti advantag facilit remov depilatori composit skin eas dispos depilatori composit along digest hair simpli peel dri composit compon impart above-not film-form properti general high-molecular-weight polym obtain substanti film-form properti depilatori composit satisfactori simpli increas concentr high-molecular-weight polym depilatori composit approach inde limit fact film-form polym excess increas viscos finish product finish product becom thick thus difficult appli skin therefor prevent user abl proper appli depilatori composit would use formul depilatori composit substanti film-form properti way viscos depilatori composit low enough proper appli skin thin film prior form film summari invent present invent relat depil composit method remov hair without caus pain depil composit present invent compris aqueous solvent system contain film-form polym compound depilatori agent wherein depil composit form peelabl film dri present invent also relat depil method compris coat aforement depilatori composit onto area skin hair remov dri result coat form peelabl film peel film depil composit present invent use blend fulli partial hydrolyz poli vinyl alcohol
"BACKGROUND OF THE INVENTION

1. Field of the Invention

The present invention relates to diagnostic assays for analytes in a liquid sample. In some embodiments, methods and devices for the detection of an analyte in a body fluid using a plurality of species-specific antibodies are provided.

2. Description of the Related Art

Many types of ligand-receptor assays have been used to detect the presence of analytes in body fluids such as saliva, urine or blood. These assays typically involve antigen-antibody reactions, synthetic conjugates comprising enzymatic, fluorescent, or visually observable tags, and specially designed reactor chambers. In most of these assays, there is a receptor (e.g., an antibody) specific for the selected analyte (e.g., antigen), and a means for detecting the presence and/or amount of the antigen-antibody reaction product. Although some commercially available tests are designed to make a quantitative determination, in many circumstances all that is required is a qualitative indication (e.g., positive/negative). Examples of such qualitative assays include blood typing, pregnancy testing, ovulation prediction and many types of urinalysis. For these tests, visually observable indicia, such as the presence of agglutination or a color change, are preferred.

Diagnostic assays should generally be very sensitive because of the often low concentrations of analytes of interest present in a test fluid. False positives can be problematic, particularly with agglutination and other rapid detection methods such as dipstick and color change tests. Because of these problems, sandwich assays which use metal sols or other types of colored particles have been developed that rely on the interaction between avidin and biotin-tagged antibodies. For example, in some commercially available pregnancy tests, an antibody-antigen sandwich complex comprising a colloidal gold-labeled anti-hCG antibody and an anti-hCG biotin-labeled antibody is used.

Because the above disclosed assays and methods enable the formation of antibody-antigen sandwich complexes in the liquid phase of an assay prior to the test line, they allow for more time for antigen recognition and binding to occur. These assays and methods therefore have greater sensitivity and discrimination for analytes of interest, resulting in greater reproducibility, sensitivity, and avoidance of false positives. Although such advances have improved these types of assays, further improvements in reliability and ease of manufacture are desirable.

SUMMARY OF THE INVENTION

The present invention provides rapid, sensitive diagnostic devices and methods for detecting the presence of analytes in body fluids. In preferred embodiments, these methods and devices have high sensitivity and result in virtually no false positives, enabling reliable results even when used by untrained persons.

In preferred embodiments, a mixed-species lateral flow assay is provided, whereby an antibody-antigen sandwich complex is captured at a test result site thorough the recognition of a species-specific antibody in the sandwich complex. The antibodies in this antibody-antigen sandwich complex are derived from different species, allowing an antibody-antigen sandwich complex to be captured at the test line by an antibody that recognizes only one of the species-specific antibodies in the sandwich complex.

A device for determining the presence of an analyte in a liquid sample is provided. The device includes a release medium forming an upstream portion of the device; at least two primary antibodies that recognize the analyte and are derived from at least two different species, where at least two primary antibodies are located in or on the release medium; a capture medium forming a downstream portion of the device; and at least one secondary antibody specific for only one of the at least two primary antibodies, where the at least one secondary antibody is located in or on the capture medium.

In some embodiments, a first one of the at least two primary antibodies is conjugated to a label, and a second one of the at least two primary antibodies is unconjugated. In some embodiments, a first antibody of the at least one secondary antibody is specific for the species from which the second one of the at least two primary antibodies is derived. In some embodiments, a second secondary antibody is located in or on the capture medium that is specific for the species from which the first one of the at least two primary antibodies is derived. In some embodiments, the first and second ones of the at least two primary antibodies in or on the release medium are deposited in or on different locations of the release medium. In some embodiments, the first and second secondary antibodies in or on the capture medium are immobilized in or on different locations of the capture medium. In some embodiments, neither of the two primary antibodies are tagged with a capturable moiety or component such as biotin.

In another embodiment, a device for determining the presence of an analyte in a liquid sample is provided. The device includes a release medium comprising: a labeled conjugate comprising a binding member derived from a first species and a label, where the binding member is reactive with a first epitope of the analyte; and a capturable component derived from a second species, where the capturable component is reactive with a second epitope of the analyte, such that if the analyte is present in the sample, a sandwich complex is formed comprising the labeled conjugate, the analyte, and the capturable component; and a capture medium comprising a capture site for capturing the complex, the capture site having immobilized thereon a capture component having specificity for the capturable component.

In another embodiment, a method of determining the presence of an analyte in a liquid sample is provided. The method includes forming a sandwich complex comprising a first primary antibody derived from a first species, the analyte, and a second primary antibody derived from a second, different species; and capturing the sandwich complex with a secondary antibody specific for only one of the first and second different species.

In another embodiment, a method for determining the presence of an analyte in a liquid sample is provided. The method includes contacting the liquid sample with a release medium comprising: a labeled conjugate comprising a binding member derived from a first species, where the binding member is reactive with a first epitope of the analyte, and where the binding member is labeled with a detectable marker; and a capturable component derived from a second species, wherein the capturable component is reactive with a second epitope of the analyte, such that if the analyte is present in the sample, a complex comprising the labeled conjugate, the analyte and the capturable component is formed. The method further comprises contacting the liquid sample with a capture medium following exposure to the release medium, where the capture medium comprises a capture site for capturing the complex, the capture site having immobilized thereon a capture component having specificity for the capturable component; and determining whether the analyte is present in the liquid sample by detecting the presence of the detectable marker at the capture site.

",9207248,CHD,395,12/8/2015,Consumer Staples,background invent 1. field invent present invent relat diagnost assay analyt liquid sampl embodi method devic detect analyt bodi fluid use plural species-specif antibodi provid 2. descript relat art mani type ligand-receptor assay use detect presenc analyt bodi fluid saliva urin blood assay typic involv antigen-antibodi reaction synthet conjug compris enzymat fluoresc visual observ tag special design reactor chamber assay receptor e.g. antibodi specif select analyt e.g. antigen mean detect presenc and/or amount antigen-antibodi reaction product although commerci avail test design make quantit determin mani circumst requir qualit indic e.g. positive/neg exampl qualit assay includ blood type pregnanc test ovul predict mani type urinalysi test visual observ indicia presenc agglutin color chang prefer diagnost assay general veri sensit becaus often low concentr analyt interest present test fluid fals posit problemat particular agglutin rapid detect method dipstick color chang test becaus problem sandwich assay use metal sol type color particl develop reli interact avidin biotin-tag antibodi exampl commerci avail pregnanc test antibody-antigen sandwich complex compris colloid gold-label anti-hcg antibodi anti-hcg biotin-label antibodi use becaus abov disclos assay method enabl format antibody-antigen sandwich complex liquid phase assay prior test line allow time antigen recognit bind occur assay method therefor greater sensit discrimin analyt interest result greater reproduc sensit avoid fals posit although advanc improv type assay improv reliabl eas manufactur desir summari invent present invent provid rapid sensit diagnost devic method detect presenc analyt bodi fluid prefer embodi method devic high sensit result virtual fals posit enabl reliabl result even use untrain person prefer embodi mixed-speci later flow assay provid wherebi antibody-antigen sandwich complex captur test result site thorough recognit species-specif antibodi sandwich complex antibodi antibody-antigen sandwich complex deriv differ speci allow antibody-antigen sandwich complex captur test line antibodi recogn onli one species-specif antibodi sandwich complex devic determin presenc analyt liquid sampl provid devic includ releas medium form upstream portion devic least two primari antibodi recogn analyt deriv least two differ speci least two primari antibodi locat releas medium captur medium form downstream portion devic least one secondari antibodi specif onli one least two primari antibodi least one secondari antibodi locat captur medium embodi first one least two primari antibodi conjug label second one least two primari antibodi unconjug embodi first antibodi least one secondari antibodi specif speci second one least two primari antibodi deriv embodi second secondari antibodi locat captur medium specif speci first one least two primari antibodi deriv embodi first second one least two primari antibodi releas medium deposit differ locat releas medium embodi first second secondari antibodi captur medium immobil differ locat captur medium embodi neither two primari antibodi tag captur moieti compon biotin anoth embodi devic determin presenc analyt liquid sampl provid devic includ releas medium compris label conjug compris bind member deriv first speci label bind member reactiv first epitop analyt captur compon deriv second speci captur compon reactiv second epitop analyt analyt present sampl sandwich complex form compris label conjug analyt captur compon captur medium compris captur site captur complex captur site immobil thereon captur compon specif captur compon anoth embodi method determin presenc analyt liquid sampl provid method includ form sandwich complex compris first primari antibodi deriv first speci analyt second primari antibodi deriv second differ speci captur sandwich complex secondari antibodi specif onli one first second differ speci anoth embodi method determin presenc analyt liquid sampl provid method includ contact liquid sampl releas medium compris label conjug compris bind member deriv first speci bind member reactiv first epitop analyt bind member label detect marker captur compon deriv second speci wherein captur compon reactiv second epitop analyt analyt present sampl complex compris label conjug analyt captur compon form method compris contact liquid sampl captur medium follow exposur releas medium captur medium compris captur site captur complex captur site immobil thereon captur compon specif captur compon determin whether analyt present liquid sampl detect presenc detect marker captur site
