text,patent_id,ticker,numpat_total,issue_date,sector,clean_corpus
"FIELD OF THE INVENTION

The present invention is related to devices that can selectively detect hyperglycosylated human chorionic gonadotropin (hCG-H) for detecting pregnancy in a woman. Another aspect of the present invention relates to a method of evaluating the viability of a pregnancy.

BACKGROUND OF THE INVENTION

Human chorionic gonadotropin (hCG) is a glycoprotein produced by the placenta soon after fertilization. This hormone has the crucial role of maintaining steroid production by the corpus luteum in early pregnancy, and ensures that pregnancy progresses unabated. Thus, the detection of hCG has been utilized as a marker for pregnancy in women. Accordingly, measurement of hCG in blood or urine has been the basis of prior and current pregnancy tests or devices.

hCG

More specifically, the hCG hormone is a member of the glycoprotein hormone family (GPH) that includes luteinizing hormone (LH), follicle stimulating hormone (FSH), and thyroid stimulating hormone (TSH). All members of the GPH family are heterodimers that consist of an alpha and beta subunit. The alpha subunit is conserved across the GPHs, while the beta subunit is unique. However, there remains about 80% homology across the beta subunits. In addition to conferring differentiation, the beta subunit also grants each heterodimer its unique biological activity and receptor specificity (Pierce and Parsons, 1981; Stenman et al., 2006).

hCG has a molecular weight of around 37 kDa. About one-third of this mass is due to glycosylation consisting of 8 oligosaccharide chains covalently bound to the alpha and beta subunits (Pierce and Parsons, 1981). It is produced by the syncytiotrophoblast cells following fertilization and its primary function is to maintain the production of progesterone by the corpus luteum in early pregnancy (Hoshina et al., 1985; Lustbader et al., 1998). During excretion, intact hCG can be partially degraded into its component subunits allowing different variants of hCG to be detected in liquid samples, such as urine.

As is well known, the association of hCG and pregnancy was first reported in 1927. During the 1960's, the advent of immunoassays allowed the direct detection of hCG in pregnancy urine (Wide and Gemzell, 1960; Vaitukaitis et al., 1972). A variety of different hCG isoforms or fragments are present in both serum and urine. Intact hCG has been discovered to be the predominant form of hCG and have the most biological relevance throughout all stages of pregnancy despite the presence of the other isoforms detected include free hCG alpha subunit, free hCG beta subunit, hCG beta core fragment, nicked hCG, and hyperglycosylated hCG (hCG-H) (O'Connor et al., 1994; McChesney et al., 2005).

hCG-H

Although intact hCG is the most prevalent form of the molecule found throughout pregnancy, other distinct isoforms have emerged with different biological activities. One such form, hyperglycosylated hCG (hCG-H), differs from regular hCG in the amount of and/or location of oligosaccharide chains present on the beta subunit of hCG. This different glycosylation pattern is believed to alter the function of the molecule such that hCG-H provides a role in promoting implantation of a developing zygote.

Whereas hCG production is typically considered to be limited to pregnancy, it has also been found to be produced in certain types of invasive cancer associated with gestational trophoblastic disease (Cole et al., 2006). These tumors (hytatidiform mole, choriocarcinoma, and placental site trophoblastic tumors) are both aggressive and malignant, and a key marker for their presence is the production of hCG (particularly the beta subunit of hCG) in the absence of pregnancy (Cole et al., 2003). Research into hCG produced by choriocarcinoma tumor cells identified that there were significant weight differences in hCG derived from choriocarcinoma when compared to hCG present in pregnancy (˜40 kDa compared to ˜37 kDa) (Hussa, 1977; Mizuochi et al., 1983; Amano et al., 1988). Further studies on the choriocarcinoma derived hCG elucidated that the weight differences were due to excess glycosylation leading to significantly larger oligosaccharides on the beta subunit (Elliott et al., 1997). The term hyperglycosylated hCG, or hCG-H, was coined for this higher molecular weight choriocarcinoma derived hCG containing invasive properties, with regular hCG reserved for the hCG with normal oligosaccharide chains found during pregnancy (Elliott et al., 1997; Cole et al., 1998).

Previously researchers developed an hCG-H monoclonal antibody by immunizing mice with hCG-H produced by a single patient with choriocarcinoma. This antibody, B152, specifically recognized choriocarcinoma derived hCG-H in both serum and urine. This allowed researchers to more effectively screen and monitor the presence of hCG-H. Subsequent studies utilizing the B152 antibody found that hCG-H is not only produced by choriocarcinoma, but it is also found in very early pregnancy as well (O'Connor et al., 1998), and that hCG-H is the predominant form of hCG produced by cytotrophoblast cells at the time of trophoblast invasion irrespective if the invasion is associated with choriocarcinoma or pregnancy (Kovalevskaya et al., 2002). Cytotrophoblast cells differ from those that produce regular hCG (syncytiotrophoblast cells), and they confer a different function to hCG-H that is closely linked with the implantation of the zygote into the uterine lining after conception (Kovalevskaya et al., 2002). Studies have also shown that hCG-H cannot replace the corpus luteum stimulating activity of regular hCG which suggests a distinct biological activity for hCG-H separate from that of pregnancy promoting function of regular hCG (Cole et al., 1991).

Early pregnancy derived hCG-H has the same molecular weight as choriocarcinoma derived hCG-H (Kovalesyskaya et al., 2002), and the majority of all hCG immunoreactivity in serum and urine samples from early pregnancy is due to the presence of hCG-H (O'Connor et al., 1998; Cole et al., 1999; Butler et al., 2002; Cole et al., 2003; Sutton-Riley et al., 2006). Further, hCG-H accounts for >90% of all hCG at the time of implantation (Cole et al., 2003). This proportion of hCG-H steadily decreases as pregnancy progresses until it only accounts for about 2% of all hCG by the 2ndand 3rdtrimesters.

Early Pregnancy Loss

There is a correlation between low or absent levels of hCG-H in early pregnancy, and early pregnancy loss. In light of research implicating that hCG-H plays a key role in trophoblast invasion, many have suggested that the high incidence of early pregnancy loss in the absence of hCG-H is due to ineffective implantation of the zygote in the uterine lining Some studies have estimated that only 30% of all fertilized eggs continue to term to result in a live birth (Zinaman et al., 1996; Slama et al., 2002). Over the years a subset of these unsuccessful pregnancies that result from a failed implantation have been given names such as ‘occult pregnancies’, ‘preclinical pregnancies’, ‘biochemical pregnancies’, and ‘early pregnancy loss’ (Macklon et al., 2002). They all serve to describe a phenomenon whereby the conceptus is unable to successfully implant and therefore pregnancy does not progress past the first few weeks after conception. The incidence of early pregnancy loss due to failed implantation has been estimated to be about 30% of all conceptions, making it a significant occurrence in fertile individuals attempting to conceive (Wilcox et al., 1988; Macklon et al., 2002).

Fertilization of the egg typically occurs in the fallopian tube approximately 24-48 hours after ovulation. The fertilized egg (now termed a zygote) continually divides as it travels through the fallopian tube. However, its survival is not ensured until it enters the uterine cavity and implants into the uterine lining. Implantation typically occurs from about 7 to about 10 days after fertilization and is the result of several complex molecular interactions that allow the developing blastocyst to embed in the lining and eventually establish contact with nutrient enriched maternal blood (Carson et al., 2000; Enders, 2000; Norwitz et al., 2001). hCG-H has been identified as a marker whose presence (or absence) can serve to indicate if this successful implantation in the uterine lining has occurred (Cole and Khanlian, 2007).

For instance, many studies have found that an unduly low proportion (or absence) of hCG-H in early pregnancy is associated with early pregnancy losses prior to the 6thweek of gestation (O'Connor et al., 1998; Kovalevskaya et al., 2002; Sutton-Riley et al., 2006). Sasaki et al. (2007) recently found that in 62 successful conceptions, only those that had an hCG-H proportion greater than 50% in the first week following conception continued to term. As such, low proportions of hCG-H around the time of implantation may destine pregnancy for failure due to an unsuccessful implantation. Such studies, taken together with the abundance of choriocarcinoma data associating hCG-H with trophoblast invasion, suggest that hCG-H has an essential role in promoting the invasive properties of the conceptus resulting in successful implantation (Lei et al., 1999; Cole et al., 2007). In the absence of the implantation promoting ability of hCG-H, the conceptus may not achieve successful implantation and ultimately result in an early pregnancy loss (Kovalevskaya et al., 2007; Cole, 2007).

hCG-H and Pregnancy Testing

Traditional pregnancy tests in both the point of care (POC) and over the counter (OTC) markets are developed to detect regular or total hCG. Although both regular hCG and hCG-H can be used to measure pregnancy, they are not equal in the results that are conveyed to the consumer (Cole et al., 2007). As up to 30% of all conceptions result in early pregnancy loss (Wilcox et al., 1988), by assaying for regular hCG alone, these non-viable pregnancies are being detected and conveyed to the consumer as a successful pregnancy. As such, regular hCG can be considered a poor discriminator of pregnancies that may ultimately result in early pregnancy loss. The overwhelming majority of currently available POC and OTC pregnancy tests poorly detect hCG-H, with only a handful of tests displaying equal sensitivity to both regular hCG and hCG-H (Butler et al., 2001; Cole et al., 2003; Cole et al., 2004).

Another shortcoming of traditional pregnancy tests is readily realized upon consideration of women who are attempting to conceive through fertility treatments. Such women are typically administered regular hCG to mimic an LH surge and promote ovulation from mature ovarian follicles. This exogenous hCG is gradually cleared from their system over a period of about 10 days (Stenman et al., 1997), but it precludes these women from taking a traditional pregnancy test as it would result in them achieving a ‘false positive’ due to lingering exogenous hCG in their system. If these individuals were to use a pregnancy test specific for hCG-H, the exogenous regular hCG in their system would likely have no bearing on the results conveyed through the test.

Currently, there is no OTC device available that can specifically detect hCG-H. However, there is an automated chemiluminescent hCG-H assay based on the B152 antibody (Nichols Advantage immunoassay) which has been cleared by the FDA for use in pregnancy related applications (Pandain et al., 2003; Weinans et al., 2005). While it is specific for hCG-H, this test requires a long sample incubation time of about 4 hours. Thus, this test must be run in a laboratory setting in order to achieve results (Cole et al., 2004). As many doctors advise women who achieve a positive pregnancy test result at home to wait for at least 6 weeks prior to scheduling a visit, the use of the laboratory based assay to detect hCG-H is not practical as those with unsuccessful implantation related to a low prevalence of hCG-H may have already suffered an early pregnancy loss prior to the doctor's visit. The development of an at home hCG-H based pregnancy test would rapidly convey to the consumer that not only are they pregnant, but that their odds for early pregnancy loss resulting from failed implantation are significantly reduced.

There remains a need for both POC and OTC pregnancy test devices that can selectively or preferentially detect hCG-H. There also remains a need for a pregnancy test device exhibiting an improved level of accuracy for determining the viability of a pregnancy.

BRIEF SUMMARY OF THE INVENTION

The present invention satisfies at least some of the aforementioned needs by providing pregnancy devices that can selectively or preferentially detect hyperglycosylated human chorionic gonadotropin (hCG-H). Embodiments of the present invention include a device for selectively or preferentially detecting hyperglycosylated human chorionic gonadotropin (hCG-H) in a liquid sample deposited on a proximal portion of the device for transport to a distal portion of the device. This particular device includes a release medium formed of a first material having a detectable label thereon and a capture medium in fluid communication with the release medium and formed of a second, different material. The capture medium includes a capture site. At least one of the release medium and the capture medium includes a binding member that exhibits a moderate to high affinity for hCG-H and is selectively or preferentially reactive with hCG-H. Devices according to embodiments of the present invention can provide confirmation of the viability of a pregnancy as only fertilized eggs with a high likelihood of successful implantation (i.e. those with an appropriate level of hCG-H) can be detected by the assay.

In other embodiments, the invention comprises a device for selectively or preferentially detecting hyperglycosylated human chorionic gonadotropin (hCG-H), in which the device includes a release medium formed of a first material and having a detectable label thereon. The device also includes a capture medium in fluid communication with the release medium and formed of a second, different material. The capture medium includes a capture site. Devices according to this particular embodiment include a scavenger component that is selectively or preferentially reactive with regular hCG. The scavenger component can be located between the location of sample deposit and the capture site. Further, at least one of the release medium and the capture medium can include a binding member that is reactive with hCG-H. In a preferred embodiment the binding member can be selectively or preferentially reactive with hCG-H and also exhibit a moderate to high affinity for hCG-H.

In certain embodiments, the device for selectively or preferentially detecting hCG-H in a liquid sample deposited on a proximal portion of the device for transport to a distal portion of the device includes a release medium formed of a first material and having a detectable label and a capture medium in fluid communication with the release medium and formed of a second, different material. The capture medium includes a capture site. Additionally, such devices include a mixture of binding members. In these embodiments, the mixture of binding members includes a first group of binding members that are selectively or preferentially reactive with an epitope of regular hCG and a second group of binding members that exhibit a moderate to high affinity for hCG-H and are selectively or preferentially reactive with an epitope of hCG-H. In one such embodiment, the binding members are selectively or preferentially reactive with hCG-H account for greater than 50% of the total number of binding members present in the mixture.

In yet another embodiment, the present invention comprises a device for selectively or preferentially detecting hCG-H in a liquid sample, in which the device includes a release medium formed of a first material and having a detectable label and a capture medium in fluid communication with the release medium. Devices according to such embodiments further include at least one binding member that exhibits a moderate to high affinity for hCG-H and is selectively or preferentially reactive with an epitope of hCG-H and at least one binding member that is reactive with an epitope of regular hCG. The capture medium is preferably formed of a second, different material, and includes a first capture site that directly or indirectly binds hCG-H and a second capture site that directly or indirectly binds regular hCG.

In certain embodiments, the present invention comprises a device for selectively or preferentially detecting hCG-H in a liquid sample, wherein the device includes a common fluid path for receiving and distributing the liquid sample. The device also includes at least one release medium in fluid communication with the common fluid path. The release medium can be formed of a first material and include a detectable label. Devices according to these embodiments can include a first capture medium in fluid communication with the at least one release medium, wherein the capture medium is preferably formed of a second material. The first capture medium includes a capture site that directly or indirectly selectively or preferentially binds hCG-H. Also, devices according to such embodiments can also preferably include a second capture medium in fluid communication with the at least one release medium and formed of the same material as the other capture medium. The second capture medium can include a capture site that directly or indirectly binds regular hCG.

In another aspect, the present invention provides a method of evaluating the viability of a pregnancy. Methods according to embodiments of the present invention include providing a test device for selectively or preferentially detecting hCG-H, as described herein, and applying a liquid sample potentially including one or both of regular hCG and hCG-H to the device. Such methods can also include detecting the presence or lack thereof of hCG-H in the liquid sample. The detected presence of hCG-H indicates a viable pregnancy.

",8278109,CHD,395,10/2/2012,Consumer Staples,field invent present invent relat devic select detect hyperglycosyl human chorion gonadotropin hcg-h detect pregnanc woman anoth aspect present invent relat method evalu viabil pregnanc background invent human chorion gonadotropin hcg glycoprotein produc placenta soon fertil hormon crucial role maintain steroid product corpus luteum earli pregnanc ensur pregnanc progress unab thus detect hcg util marker pregnanc women accord measur hcg blood urin basi prior current pregnanc test devic hcg specif hcg hormon member glycoprotein hormon famili gph includ lutein hormon lh follicl stimul hormon fsh thyroid stimul hormon tsh member gph famili heterodim consist alpha beta subunit alpha subunit conserv across gphs beta subunit uniqu howev remain 80 homolog across beta subunit addit confer differenti beta subunit also grant heterodim uniqu biolog activ receptor specif pierc parson 1981 stenman et al. 2006 hcg molecular weight around 37 kda one-third mass due glycosyl consist 8 oligosaccharid chain coval bound alpha beta subunit pierc parson 1981 produc syncytiotrophoblast cell follow fertil primari function maintain product progesteron corpus luteum earli pregnanc hoshina et al. 1985 lustbad et al. 1998 dure excret intact hcg partial degrad compon subunit allow differ variant hcg detect liquid sampl urin well known associ hcg pregnanc first report 1927. dure 1960 's advent immunoassay allow direct detect hcg pregnanc urin wide gemzel 1960 vaituka et al. 1972 varieti differ hcg isoform fragment present serum urin intact hcg discov predomin form hcg biolog relev throughout stage pregnanc despit presenc isoform detect includ free hcg alpha subunit free hcg beta subunit hcg beta core fragment nick hcg hyperglycosyl hcg hcg-h o'connor et al. 1994 mcchesney et al. 2005 hcg-h although intact hcg preval form molecul found throughout pregnanc distinct isoform emerg differ biolog activ one form hyperglycosyl hcg hcg-h differ regular hcg amount and/or locat oligosaccharid chain present beta subunit hcg differ glycosyl pattern believ alter function molecul hcg-h provid role promot implant develop zygot wherea hcg product typic consid limit pregnanc also found produc certain type invas cancer associ gestat trophoblast diseas cole et al. 2006 tumor hytatidiform mole choriocarcinoma placent site trophoblast tumor aggress malign key marker presenc product hcg particular beta subunit hcg absenc pregnanc cole et al. 2003 research hcg produc choriocarcinoma tumor cell identifi signific weight differ hcg deriv choriocarcinoma compar hcg present pregnanc kda compar kda hussa 1977 mizuochi et al. 1983 amano et al. 1988 studi choriocarcinoma deriv hcg elucid weight differ due excess glycosyl lead signific larger oligosaccharid beta subunit elliott et al. 1997 term hyperglycosyl hcg hcg-h coin higher molecular weight choriocarcinoma deriv hcg contain invas properti regular hcg reserv hcg normal oligosaccharid chain found dure pregnanc elliott et al. 1997 cole et al. 1998 previous research develop hcg-h monoclon antibodi immun mice hcg-h produc singl patient choriocarcinoma antibodi b152 specif recogn choriocarcinoma deriv hcg-h serum urin allow research effect screen monitor presenc hcg-h. subsequ studi util b152 antibodi found hcg-h onli produc choriocarcinoma also found veri earli pregnanc well o'connor et al. 1998 hcg-h predomin form hcg produc cytotrophoblast cell time trophoblast invas irrespect invas associ choriocarcinoma pregnanc kovalevskaya et al. 2002 cytotrophoblast cell differ produc regular hcg syncytiotrophoblast cell confer differ function hcg-h close link implant zygot uterin line concept kovalevskaya et al. 2002 studi also shown hcg-h replac corpus luteum stimul activ regular hcg suggest distinct biolog activ hcg-h separ pregnanc promot function regular hcg cole et al. 1991 earli pregnanc deriv hcg-h molecular weight choriocarcinoma deriv hcg-h kovalesyskaya et al. 2002 major hcg immunoreact serum urin sampl earli pregnanc due presenc hcg-h o'connor et al. 1998 cole et al. 1999 butler et al. 2002 cole et al. 2003 sutton-riley et al. 2006 hcg-h account > 90 hcg time implant cole et al. 2003 proport hcg-h steadili decreas pregnanc progress onli account 2 hcg 2ndand 3rdtrimest earli pregnanc loss correl low absent level hcg-h earli pregnanc earli pregnanc loss light research implic hcg-h play key role trophoblast invas mani suggest high incid earli pregnanc loss absenc hcg-h due ineffect implant zygot uterin line studi estim onli 30 fertil egg continu term result live birth zinaman et al. 1996 slama et al. 2002 year subset unsuccess pregnanc result fail implant given name occult pregnanc preclin pregnanc biochem pregnanc earli pregnanc loss macklon et al. 2002 serv describ phenomenon wherebi conceptus unabl success implant therefor pregnanc doe progress past first week concept incid earli pregnanc loss due fail implant estim 30 concept make signific occurr fertil individu attempt conceiv wilcox et al. 1988 macklon et al. 2002 fertil egg typic occur fallopian tube approxim 24-48 hour ovul fertil egg term zygot continu divid travel fallopian tube howev surviv ensur enter uterin caviti implant uterin line implant typic occur 7 10 day fertil result sever complex molecular interact allow develop blastocyst emb line eventu establish contact nutrient enrich matern blood carson et al. 2000 ender 2000 norwitz et al. 2001 hcg-h identifi marker whose presenc absenc serv indic success implant uterin line occur cole khanlian 2007 instanc mani studi found unduli low proport absenc hcg-h earli pregnanc associ earli pregnanc loss prior 6thweek gestat o'connor et al. 1998 kovalevskaya et al. 2002 sutton-riley et al. 2006 sasaki et al 2007 recent found 62 success concept onli hcg-h proport greater 50 first week follow concept continu term low proport hcg-h around time implant may destin pregnanc failur due unsuccess implant studi taken togeth abund choriocarcinoma data associ hcg-h trophoblast invas suggest hcg-h essenti role promot invas properti conceptus result success implant lei et al. 1999 cole et al. 2007 absenc implant promot abil hcg-h conceptus may achiev success implant ultim result earli pregnanc loss kovalevskaya et al. 2007 cole 2007 hcg-h pregnanc test tradit pregnanc test point care poc counter otc market develop detect regular total hcg although regular hcg hcg-h use measur pregnanc equal result convey consum cole et al. 2007 30 concept result earli pregnanc loss wilcox et al. 1988 assay regular hcg alon non-viabl pregnanc detect convey consum success pregnanc regular hcg consid poor discrimin pregnanc may ultim result earli pregnanc loss overwhelm major current avail poc otc pregnanc test poor detect hcg-h onli hand test display equal sensit regular hcg hcg-h butler et al. 2001 cole et al. 2003 cole et al. 2004 anoth shortcom tradit pregnanc test readili realiz upon consider women attempt conceiv fertil treatment women typic administ regular hcg mimic lh surg promot ovul matur ovarian follicl exogen hcg gradual clear system period 10 day stenman et al. 1997 preclud women take tradit pregnanc test would result achiev fals posit due linger exogen hcg system individu use pregnanc test specif hcg-h exogen regular hcg system would like bear result convey test current otc devic avail specif detect hcg-h. howev autom chemiluminesc hcg-h assay base b152 antibodi nichol advantag immunoassay clear fda use pregnanc relat applic pandain et al. 2003 weinan et al. 2005 specif hcg-h test requir long sampl incub time 4 hour thus test must run laboratori set order achiev result cole et al. 2004 mani doctor advis women achiev posit pregnanc test result home wait least 6 week prior schedul visit use laboratori base assay detect hcg-h practic unsuccess implant relat low preval hcg-h may alreadi suffer earli pregnanc loss prior doctor 's visit develop home hcg-h base pregnanc test would rapid convey consum onli pregnant odd earli pregnanc loss result fail implant signific reduc remain need poc otc pregnanc test devic select preferenti detect hcg-h. also remain need pregnanc test devic exhibit improv level accuraci determin viabil pregnanc brief summari invent present invent satisfi least aforement need provid pregnanc devic select preferenti detect hyperglycosyl human chorion gonadotropin hcg-h embodi present invent includ devic select preferenti detect hyperglycosyl human chorion gonadotropin hcg-h liquid sampl deposit proxim portion devic transport distal portion devic particular devic includ releas medium form first materi detect label thereon captur medium fluid communic releas medium form second differ materi captur medium includ captur site least one releas medium captur medium includ bind member exhibit moder high affin hcg-h select preferenti reactiv hcg-h. devic accord embodi present invent provid confirm viabil pregnanc onli fertil egg high likelihood success implant i.e appropri level hcg-h detect assay embodi invent compris devic select preferenti detect hyperglycosyl human chorion gonadotropin hcg-h devic includ releas medium form first materi detect label thereon devic also includ captur medium fluid communic releas medium form second differ materi captur medium includ captur site devic accord particular embodi includ scaveng compon select preferenti reactiv regular hcg scaveng compon locat locat sampl deposit captur site least one releas medium captur medium includ bind member reactiv hcg-h. prefer embodi bind member select preferenti reactiv hcg-h also exhibit moder high affin hcg-h. certain embodi devic select preferenti detect hcg-h liquid sampl deposit proxim portion devic transport distal portion devic includ releas medium form first materi detect label captur medium fluid communic releas medium form second differ materi captur medium includ captur site addit devic includ mixtur bind member embodi mixtur bind member includ first group bind member select preferenti reactiv epitop regular hcg second group bind member exhibit moder high affin hcg-h select preferenti reactiv epitop hcg-h. one embodi bind member select preferenti reactiv hcg-h account greater 50 total number bind member present mixtur yet anoth embodi present invent compris devic select preferenti detect hcg-h liquid sampl devic includ releas medium form first materi detect label captur medium fluid communic releas medium devic accord embodi includ least one bind member exhibit moder high affin hcg-h select preferenti reactiv epitop hcg-h least one bind member reactiv epitop regular hcg captur medium prefer form second differ materi includ first captur site direct indirect bind hcg-h second captur site direct indirect bind regular hcg certain embodi present invent compris devic select preferenti detect hcg-h liquid sampl wherein devic includ common fluid path receiv distribut liquid sampl devic also includ least one releas medium fluid communic common fluid path releas medium form first materi includ detect label devic accord embodi includ first captur medium fluid communic least one releas medium wherein captur medium prefer form second materi first captur medium includ captur site direct indirect select preferenti bind hcg-h. also devic accord embodi also prefer includ second captur medium fluid communic least one releas medium form materi captur medium second captur medium includ captur site direct indirect bind regular hcg anoth aspect present invent provid method evalu viabil pregnanc method accord embodi present invent includ provid test devic select preferenti detect hcg-h describ herein appli liquid sampl potenti includ one regular hcg hcg-h devic method also includ detect presenc lack thereof hcg-h liquid sampl detect presenc hcg-h indic viabl pregnanc
